<?xml version="1.0" encoding="utf-8"?>

<TestChoice:document xmlns:xsi="http://www.w3.org/2001/XMLSchema-instance" xsi:schemaLocation="TestChoice choice_element.xsd" xmlns:TestChoice="TestChoice">
    <TestElement1>
        <element1>eere</element1>
        <choice1>aaaa</choice1>
        <element2></element2>
    </TestElement1>
    <TestElement2>
        <choice3>E2R3</choice3>
    </TestElement2>
    <TestElement5>
        <choice2>20</choice2>
        <choice4>55.6</choice4>
    </TestElement5>
</TestChoice:document>